{
  "schema_version": "1.0.0",
  "library_id": "zenta-starter-visibility-20260714-v01",
  "brand": "Zenta Creative",
  "created_at": "2026-07-14T06:10:00-03:00",
  "status": "draft_for_human_review",
  "assumptions": [
    "Initial concepts target owners of small and growing businesses in Suriname.",
    "Meta Feed and Instagram Feed placement details must be confirmed in the current account preview before publishing.",
    "Zenta will provide an approved high-resolution logo or add the Zenta. wordmark during final design review.",
    "Prices and package scope are based on the Zenta Creative website on 2026-07-14 and must be rechecked before use."
  ],
  "prompts": [
    {
      "prompt_id": "growth-site-digital-front-door-en-01",
      "content_type": "paid_ad_image",
      "campaign": {
        "objective": "lead generation",
        "conversion": "qualified WhatsApp project inquiry",
        "service_id": "website-growth",
        "audience": "Suriname business owners whose online presence does not clearly turn discovery into contact",
        "funnel_stage": "consideration",
        "platforms": ["Meta"],
        "placements": ["Facebook Feed", "Instagram Feed"],
        "geography": "Suriname",
        "language": "English"
      },
      "creative_strategy": {
        "concept_name": "The digital front door",
        "audience_insight": "A business owner may have social profiles but still lack one credible place that explains the offer and makes contact easy.",
        "message_angle": "A website and Google presence work together as the business's digital front door.",
        "framework": "Before-After-Bridge",
        "hook": "Your business deserves more than a link.",
        "hypothesis": "A tangible digital-front-door metaphor will make the combined website and visibility offer easier to understand than a generic website mockup."
      },
      "format": {
        "aspect_ratio": "4:5",
        "orientation": "portrait",
        "spec_status": "needs_platform_preview",
        "crop_guidance": "Keep the owner, glowing doorway, headline area, and Zenta brand cue inside the central composition with generous edge clearance."
      },
      "visual_direction": {
        "subject": "A confident Suriname small-business owner standing at the threshold of a luminous digital storefront",
        "action": "The owner opens a sleek dark doorway that reveals a clear website, local discovery, and WhatsApp contact journey",
        "environment": "Contemporary Paramaribo commercial setting with subtle tropical daylight and no identifiable private business branding",
        "composition": "Full-bleed portrait composition; human subject in the lower-left third, luminous doorway in the center, clean dark negative space across the upper third for a short headline",
        "lighting": "Cinematic natural daylight mixed with restrained lime and cyan interface glow",
        "palette": ["#030507", "#F4F7FB", "#B9FF66", "#5EE7FF", "#9B7CFF"],
        "style": "Premium editorial advertising photography with realistic people, crisp dimensional lighting, and minimal abstract digital interface cues"
      },
      "copy": {
        "overlay_headline": "Your business deserves more than a link.",
        "overlay_support": "Website + Google visibility",
        "cta": "Start your project",
        "caption": "Give customers one clear place to understand your business, trust what they see, and reach you. Zenta builds conversion-focused websites with Google visibility and WhatsApp contact flows for businesses in Suriname."
      },
      "generation_prompt": "Create a premium 4:5 portrait advertising image for Zenta Creative. Show an authentic, confident Suriname small-business owner opening a sleek luminous digital storefront doorway in a contemporary Paramaribo commercial environment. Through the doorway, suggest a connected journey from local discovery to a polished website to WhatsApp contact using elegant abstract interface layers, never copied Google, Meta, or WhatsApp screens. Place the person in the lower-left third, the doorway centrally, and preserve uncluttered near-black negative space across the upper third. Use #030507, white, lime #B9FF66, cyan #5EE7FF, and a restrained violet accent. Cinematic editorial photography, realistic skin and hands, crisp details, sophisticated dimensional light, confident and accessible mood. Render only the exact headline 'Your business deserves more than a link.' and the short support line 'Website + Google visibility' in bold clean sans-serif, plus a small 'Zenta.' wordmark; no other text. Keep all important elements comfortably away from edges for placement cropping.",
      "negative_constraints": [
        "no fake testimonials, metrics, rankings, leads, or guarantees",
        "no copied Google, Meta, Facebook, Instagram, or WhatsApp interfaces or logos",
        "no generic handshake stock-photo composition",
        "no stereotypical clothing, landmarks, or cultural props",
        "no misspelled or extra text",
        "no distorted faces, fingers, laptops, or phones"
      ],
      "accessibility": {
        "alt_text": "A Suriname business owner opens a glowing digital storefront that symbolizes a connected website, Google visibility, and WhatsApp contact journey.",
        "contrast_note": "Use white or near-black headline text only where contrast is strong; verify readability at mobile feed size."
      },
      "compliance": {
        "claim_risk": "low",
        "required_review": [
          "Verify service scope against the live Growth package.",
          "Confirm no third-party platform trade dress appears in the generated image.",
          "Preview cropping and text rendering in every selected Meta placement."
        ]
      },
      "production": {
        "render_text_in_image": true,
        "logo_instruction": "Use only the approved Zenta. wordmark; replace any generated approximation during final design review.",
        "human_review_required": true,
        "generation_status": "not_generated"
      }
    },
    {
      "prompt_id": "google-visibility-found-when-it-matters-nl-01",
      "content_type": "paid_ad_image",
      "campaign": {
        "objective": "lead generation",
        "conversion": "Google Business Profile setup inquiry",
        "service_id": "google-visibility",
        "audience": "Lokale ondernemers in Suriname met een ontbrekend, onvolledig of onduidelijk bedrijfsprofiel",
        "funnel_stage": "consideration",
        "platforms": ["Meta"],
        "placements": ["Facebook Feed", "Instagram Feed"],
        "geography": "Suriname",
        "language": "Dutch"
      },
      "creative_strategy": {
        "concept_name": "Het beslissende zoekmoment",
        "audience_insight": "Een klant zoekt vaak op locatie, openingstijd of dienst vlak voordat die belt, bezoekt of een bericht stuurt.",
        "message_angle": "Maak essentiële bedrijfsinformatie duidelijk op het moment dat een klant zoekt.",
        "framework": "Feature-Advantage-Benefit",
        "hook": "Word gevonden wanneer het telt.",
        "hypothesis": "Een herkenbaar lokaal zoekmoment zal de waarde van correcte bedrijfsinformatie sterker maken dan een abstracte uitleg over profieloptimalisatie."
      },
      "format": {
        "aspect_ratio": "4:5",
        "orientation": "portrait",
        "spec_status": "needs_platform_preview",
        "crop_guidance": "Keep the searcher, storefront, directional light path, headline, and brand mark within a centered crop-safe composition."
      },
      "visual_direction": {
        "subject": "Een klant in Paramaribo die op een smartphone een lokaal bedrijf probeert te vinden",
        "action": "Een abstracte lichtlijn verbindt de zoekactie op de telefoon met een echte professionele winkelpui",
        "environment": "Een geloofwaardige, moderne straat met Surinaamse stedelijke details zonder herkenbare bedrijfsnamen",
        "composition": "Portrait split-depth scene with the searching customer in the foreground right, the business entrance in the midground left, and uncluttered dark space above for copy",
        "lighting": "Warm late-afternoon daylight balanced with a precise lime navigation glow",
        "palette": ["#030507", "#F4F7FB", "#B9FF66", "#5EE7FF", "#FFB86B"],
        "style": "Authentieke commerciële fotografie met subtiele ruimtelijke digitale signalen en een rustige, professionele uitstraling"
      },
      "copy": {
        "overlay_headline": "Word gevonden wanneer het telt.",
        "overlay_support": "Google Bedrijfsprofiel + Maps",
        "cta": "Stel je profiel goed in",
        "caption": "Klanten zoeken naar je locatie, openingstijden en contactgegevens voordat ze een keuze maken. Zenta helpt bedrijven in Suriname hun Google Bedrijfsprofiel en Maps-informatie duidelijk in te stellen of te verbeteren."
      },
      "generation_prompt": "Maak een hoogwaardige 4:5 advertentieafbeelding voor Zenta Creative. Toon een echte, hedendaagse klant in Paramaribo die op een smartphone naar een lokaal bedrijf zoekt. Laat een elegante abstracte limekleurige lichtlijn vanaf de telefoon naar een professionele winkel- of kantoorentree lopen, als visuele metafoor voor lokale vindbaarheid. Gebruik geen echte Google-interface, kaartpin, logo of nagebouwd zoekresultaat. Plaats de klant rechtsvoor, de bedrijfsentree links in het midden en laat bovenaan rustige donkere ruimte voor tekst. Gebruik een bijna zwarte basis #030507, wit, lime #B9FF66, cyan #5EE7FF en een subtiel warm daglichtaccent. Authentieke commerciële fotografie, realistische handen en telefoon, geloofwaardige Surinaamse stedelijke context zonder stereotypes. Plaats uitsluitend de exacte kop 'Word gevonden wanneer het telt.' en de steunregel 'Google Bedrijfsprofiel + Maps' in vet, helder schreefloos lettertype, plus een klein 'Zenta.' woordmerk. Geen andere tekst.",
      "negative_constraints": [